,book_id,title,image_url,url,num_pages,ratings_count,description,genre,name,book_id_mapping
42,34497,The Color of Magic Discworld 1 Rincewind 1,https://images.gr-assets.com/books/1407111017m/34497.jpg,https://www.goodreads.com/book/show/34497.The_Color_of_Magic,228,195805,"Terry Pratchett's profoundly irreverent, bestselling novels have garnered him a revered position in the halls of parody next to the likes of Mark Twain, Kurt Vonnegut, Douglas Adams, and Carl Hiaasen.
The Color of Magicis Terry Pratchett's maiden voyage through the now-legendary land of Discworld. This is where it all begins -- with the tourist Twoflower and his wizard guide, Rincewind.
On a world supported on the back of a giant turtle (sex unknown), a gleeful, explosive, wickedly eccentric expedition sets out. There's an avaricious but inept wizard, a naive tourist whose luggage moves on hundreds of dear little legs, dragons who only exist if you believe in them, and of course THE EDGE of the planet...","['fantasy, paranormal', 'fiction', 'comics, graphic', 'young-adult']",Terry Pratchett,134
43,676924,Betrayed House of Night 2,https://s.gr-assets.com/assets/nophoto/book/111x148-bcc042a9c91a29c1d680899eff700a03.png,https://www.goodreads.com/book/show/676924.Betrayed,310,206646,"Also see: Alternate Cover Editions for this ISBN [ACE] 

Zoey, High Priestess in training, has managed to settle in at the House of Night and come to terms with the vast powers the Vampyre Goddess Nyx has given her. Just as she finally feels she belongs, the unthinkable happens: human teenagers are being killed, and all evidence points to the House of Night. While danger stalks the humans from Zoey's old life, she begins to realize that the very powers that make her so unique might also threaten those she loves.","['romance', 'fiction', 'young-adult', 'fantasy, paranormal']",Kristin Cast,570
44,60510,Poison Study Study 1,https://s.gr-assets.com/assets/nophoto/book/111x148-bcc042a9c91a29c1d680899eff700a03.png,https://www.goodreads.com/book/show/60510.Poison_Study,409,98319,"Choose: A quick death...Or slow poison...
About to be executed for murder, Yelena is offered an extraordinary reprieve. She'll eat the best meals, have rooms in the palace--and risk assassination by anyone trying to kill the Commander of Ixia.
And so Yelena chooses to become a food taster. But the chief of security, leaving nothing to chance, deliberately feeds her Butterfly's Dust--and only by appearing for her daily antidote will she delay an agonizing death from the poison.
As Yelena tries to escape her new dilemma, disasters keep mounting. Rebels plot to seize Ixia and Yelena develops magical powers she can't control. Her life is threatened again and choices must be made. But this time the outcomes aren't so clear...","['fantasy, paranormal', 'young-adult', 'fiction', 'romance', 'mystery, thriller, crime', 'history, historical fiction, biography']",Maria V. Snyder,447
45,7046495,Lover Mine Black Dagger Brotherhood 8,https://s.gr-assets.com/assets/nophoto/book/111x148-bcc042a9c91a29c1d680899eff700a03.png,https://www.goodreads.com/book/show/7046495-lover-mine,528,83866,"John Matthew has come a long way since he was found living among humans, his vampire nature unknown to himself and to those around him. After he was taken in by the Brotherhood, no one could guess what his true history was- or his true identity. Indeed, the fallen Brother Darius has returned, but with a different face and a very different destiny. As a vicious personal vendetta takes John into the heart of the war, he will need to call up on both who he is now and who he once was in order to face off against evil incarnate.
Xhex, a symphath assassin, has long steeled herself against the attraction between her and John Matthew. Having already lost one lover to madness, she will not allow the male of worth to fall prey to the darkness of her twisted life. When fate intervenes, however, the two discover that love, like destiny, is inevitable between soul mates.","['fantasy, paranormal', 'romance', 'fiction']",J.R. Ward,389
46,45978,Eldest The Inheritance Cycle 2,https://images.gr-assets.com/books/1387119654m/45978.jpg,https://www.goodreads.com/book/show/45978.Eldest,704,253839,"Darkness falls...despair abounds...evil reigns...Eragon and his dragon, Saphira, have just saved the rebel state from destruction by the mighty forces of King Galbatorix, cruel ruler of the Empire. Now Eragon must travel to Ellesmera, land of the elves, for further training in the skills of the Dragon Rider. Ages 12+.
Darkness falls...despair abounds...evil reigns...
Eragon and his dragon, Saphira, have just saved the rebel state from destruction by the mighty forces of King Galbatorix, cruel ruler of the Empire. Now Eragon must travel to Ellesmera, land of the elves, for further training in the skills of the Dragon Rider: magic and swordsmanship. Soon he is on the journey of a lifetime, his eyes open to awe-inspring new places and people, his days filled with fresh adventure. But chaos and betrayal plague him at every turn, and nothing is what it seems. Before long, Eragon doesn't know whom he can trust.
Meanwhile, his cousin Roran must fight a new battle-one that might put Eragon in even graver danger.
Will the king's dark hand strangle all resistance? Eragon may not escape with even his life. . . .","['young-adult', 'fantasy, paranormal', 'fiction', 'children', 'romance']",Christopher Paolini,644
47,2248573,Brisingr The Inheritance Cycle 3,https://s.gr-assets.com/assets/nophoto/book/111x148-bcc042a9c91a29c1d680899eff700a03.png,https://www.goodreads.com/book/show/2248573.Brisingr,748,215791,"Oaths sworn... loyalties tested... forces collide.
It's been only months since Eragon first uttered ""brisingr"", an ancient language term for fire. Since then, he's not only learned to create magic with words -- he's been challenged to his very core. Following the colossal battle against the Empires warriors on the Burning Plains, Eragon and his dragon, Saphira, have narrowly escaped with their lives. Still, there is more adventure at hand for the Rider and his dragon, as Eragon finds himself bound by a tangle of promises he may not be able to keep.
First is Eragon's oath to his cousin, Roran: to help rescue Roran's beloved from King Galbatorix's clutches. But Eragon owes his loyalty to others, too. The Varden are in desperate need of his talents and strength -- as are the elves and dwarves. When unrest claims the rebels and danger strikes from every corner, Eragon must make choices -- choices that will take him across the Empire and beyond, choices that may lead to unimagined sacrifice.
Eragon is the greatest hope to rid the land of tyranny. Can this once simple farm boy unite the rebel forces and defeat the king?","['fantasy, paranormal', 'young-adult', 'fiction', 'children', 'romance']",Christopher Paolini,373
48,113436,Eragon The Inheritance Cycle 1,https://images.gr-assets.com/books/1366212852m/113436.jpg,https://www.goodreads.com/book/show/113436.Eragon,503,1128913,"Eragon and the fledgling dragon must navigate the dangerous terrain and dark enemies of an empire ruled by a king whose evil knows no bounds. Can Eragon take up the mantle of the legendary Dragon Riders?
When Eragon finds a polished blue stone in the forest, he thinks it is the lucky discovery of a poor farm boy; perhaps it will buy his family meat for the winter. But when the stone brings a dragon hatchling, Eragon realizes he has stumbled upon a legacy nearly as old as the Empire itself. Overnight his simple life is shattered, and he is thrust into a perilous new world of destiny, magic, and power. With only an ancient sword and the advice of an old storyteller for guidance, Eragon and the fledgling dragon must navigate the dangerous terrain and dark enemies of an Empire ruled by a king whose evil knows no bounds. Can Eragon take up the mantle of the legendary Dragon Riders? The fate of the Empire may rest in his hands. . . .","['fantasy, paranormal', 'young-adult', 'fiction', 'children', 'romance']",Christopher Paolini,458
49,162085,Pretty Little Liars Pretty Little Liars 1,https://images.gr-assets.com/books/1377830522m/162085.jpg,https://www.goodreads.com/book/show/162085.Pretty_Little_Liars,286,158616,"Three years ago, Alison disappeared after a slumber party, not to be seen since. Her friends at the elite Pennsylvania school mourned her, but they also breathed secret sighs of relief. Each of them guarded a secret that only Alison had known. Now they have other dirty little secrets, secrets that could sink them in their gossip-hungry world. When each of them begins receiving anonymous emails and text messages, panic sets in. Are they being betrayed by some one in their circle? Worse yet: Is Alison back? A strong launch for a suspenseful series.","['young-adult', 'mystery, thriller, crime', 'fiction', 'romance']",Sara Shepard,790
50,11127,The Chronicles of Narnia Chronicles of Narnia 17,https://images.gr-assets.com/books/1449868701m/11127.jpg,https://www.goodreads.com/book/show/11127.The_Chronicles_of_Narnia,767,382518,"Journeys to the end of the world, fantastic creatures, and epic battles between good and evil--what more could any reader ask for in one book? The book that has it all is The Lion, the Witch and the Wardrobe, written in 1949 by Clive Staples Lewis. But Lewis did not stop there. Six more books followed, and together they became known as The Chronicles of Narnia.
For the past fifty years, The Chronicles of Narniahave transcended the fantasy genre to become part of the canon of classic literature. Each of the seven books is a masterpiece, drawing the reader into a land where magic meets reality, and the result is a fictional world whose scope has fascinated generations.
This edition presents all seven books--unabridged--in one impressive volume. The books are presented here in chronlogical order, each chapter graced with an illustration by the original artist, Pauline Baynes. Deceptively simple and direct, The Chronicles of Narniacontinue to captivate fans with adventures, characters, and truths that speak to readers of all ages, even fifty years after they were first published.","['fantasy, paranormal', 'fiction', 'young-adult', 'children']",Pauline Baynes,254
51,8683812,The Paris Wife,https://images.gr-assets.com/books/1320545874m/8683812.jpg,https://www.goodreads.com/book/show/8683812-the-paris-wife,314,195263,"A deeply evocative story of ambition and betrayal, The Paris Wife captures a remarkable period of time and a love affair between two unforgettable people: Ernest Hemingway and his wife Hadley.
Chicago, 1920: Hadley Richardson is a quiet twenty-eight-year-old who has all but given up on love and happiness--until she meets Ernest Hemingway and her life changes forever. Following a whirlwind courtship and wedding, the pair set sail for Paris, where they become the golden couple in a lively and volatile group--the fabled ""Lost Generation""--that includes Gertrude Stein, Ezra Pound, and F. Scott and Zelda Fitzgerald.
Though deeply in love, the Hemingways are ill prepared for the hard-drinking and fast-living life of Jazz Age Paris, which hardly values traditional notions of family and monogamy. Surrounded by beautiful women and competing egos, Ernest struggles to find the voice that will earn him a place in history, pouring all the richness and intensity of his life with Hadley and their circle of friends into the novel that will become The Sun Also Rises. Hadley, meanwhile, strives to hold on to her sense of self as the demands of life with Ernest grow costly and her roles as wife, friend, and muse become more challenging. Despite their extraordinary bond, they eventually find themselves facing the ultimate crisis of their marriage--a deception that will lead to the unraveling of everything they've fought so hard for.
A heartbreaking portrayal of love and torn loyalty, The Paris Wife is all the more poignant because we know that, in the end, Hemingway wrote that he would rather have died than fallen in love with anyone but Hadley.","['fiction', 'history, historical fiction, biography', 'romance', 'non-fiction']",Paula McLain,725
52,17851885,I Am Malala The Story of the Girl Who Stood Up for Education and Was Shot by the Taliban,https://images.gr-assets.com/books/1375414895m/17851885.jpg,https://www.goodreads.com/book/show/17851885-i-am-malala,327,228884,"I come from a country that was created at midnight. When I almost died it was just after midday.
When the Taliban took control of the Swat Valley in Pakistan, one girl spoke out. Malala Yousafzai refused to be silenced and fought for her right to an education.
On Tuesday, October 9, 2012, when she was fifteen, she almost paid the ultimate price. She was shot in the head at point-blank range while riding the bus home from school, and few expected her to survive.
Instead, Malala's miraculous recovery has taken her on an extraordinary journey from a remote valley in northern Pakistan to the halls of the United Nations in New York. At sixteen, she has become a global symbol of peaceful protest and the youngest-ever Nobel Peace Prize laureate.
I Am Malalais the remarkable tale of a family uprooted by global terrorism, of the fight for girls' education, of a father who, himself a school owner, championed and encouraged his daughter to write and attend school, and of brave parents who have a fierce love for their daughter in a society that prizes sons.","['non-fiction', 'history, historical fiction, biography', 'young-adult', 'comics, graphic']",Christina Lamb,89
53,6131164,Clockwork Princess The Infernal Devices 3,https://images.gr-assets.com/books/1460477760m/6131164.jpg,https://www.goodreads.com/book/show/6131164-clockwork-princess,570,69293,"Danger and betrayal, secrets and enchantment in the breathtaking conclusion to the Infernal Devices trilogy.
Tessa Gray should be happy - aren't all brides happy?
Yet as she prepares for her wedding, a net of shadows begins to tighten around the Shadowhunters of the London Institute.
A new demon appears, one linked by blood and secrecy to Mortmain, the man who plans to use his army of pitiless automatons, the Infernal Devices, to destroy the Shadowhunters. Mortmain needs only one last item to complete his plan. He needs Tessa. And Jem and Will, the boys who lay equal claim to Tessa's heart, will do anything to save her.","['fantasy, paranormal', 'young-adult', 'romance', 'fiction', 'history, historical fiction, biography', 'mystery, thriller, crime']",Cassandra Clare,262
54,9822,Mrs Frisby and the Rats of NIMH Rats of NIMH 1,https://images.gr-assets.com/books/1351191064m/9822.jpg,https://www.goodreads.com/book/show/9822.Mrs_Frisby_and_the_Rats_of_NIMH,240,138003,"Mrs. Frisby, a widowed mouse with four small children, must move her family to their summer quarters immediately, or face almost certain death. But her youngest son, Timothy, lies ill with pneumonia and must not be moved. Fortunately, she encounters the rats of NIMH, an extraordinary breed of highly intelligent creatures, who come up with a brilliant solution to her dilemma.","['fantasy, paranormal', 'children', 'fiction', 'young-adult']",Robert C. O'Brien,394
55,13615258,Free Four Tobias Tells the Divergent KnifeThrowing Scene Divergent 15,https://images.gr-assets.com/books/1399503802m/13615258.jpg,https://www.goodreads.com/book/show/13615258-free-four,43,82006,"#1 New York Timesbestselling author Veronica Roth retells a pivotal Divergentscene (chapter 13) from Tobias's point of view. This thirteen-page scene reveals unknown facts and fascinating details about Four's character, his past, his own initiation, and his thoughts about new Dauntless initiate Tris Prior.","['young-adult', 'fiction', 'fantasy, paranormal', 'romance']",Veronica Roth,697
56,11387515,Wonder Wonder 1,https://images.gr-assets.com/books/1309285027m/11387515.jpg,https://www.goodreads.com/book/show/11387515-wonder,316,255461,"I won't describe what I look like. Whatever you're thinking, it's probably worse.
August (Auggie) Pullman was born with a facial deformity that prevented him from going to a mainstream school--until now. He's about to start 5th grade at Beecher Prep, and if you've ever been the new kid then you know how hard that can be. The thing is Auggie's just an ordinary kid, with an extraordinary face. But can he convince his new classmates that he's just like them, despite appearances?
R. J. Palacio has written a spare, warm, uplifting story that will have readers laughing one minute and wiping away tears the next. With wonderfully realistic family interactions (flawed, but loving), lively school scenes, and short chapters, Wonderis accessible to readers of all levels.","['young-adult', 'fiction', 'children']",R.J. Palacio,407
57,12751687,Finale Hush Hush 4,https://images.gr-assets.com/books/1362408156m/12751687.jpg,https://www.goodreads.com/book/show/12751687-finale,454,109752,"Will love conquer all?
Nora and Patch thought their troubles were behind them. Hank is gone and they should be able to put his ugly vendetta to rest. But in Hank's absence, Nora has become the unwitting head of the Nephilim and must finish what Hank began. Which ultimately means destroying the fallen angels - destroying Patch.
Nora will never let that happen, so she and Patch make a plan: lead everyone to believe they have broken up, and work the system from the inside. Nora will convince the Nephilim that they are making a mistake in fighting the fallen angels, and Patch will find out everything he can from the opposing side. They will end this war before it can even begin.
But the best-laid plans often go awry. Nora is put through the paces in her new role and finds herself drawn to an addictive power she never anticipated.
As the battle lines are drawn, Nora and Patch must confront the differences that have always been between them and either choose to ignore them or let them destroy the love they have always fought for.","['young-adult', 'fantasy, paranormal', 'romance', 'fiction', 'mystery, thriller, crime']",Becca Fitzpatrick,642
58,19691,The Hunt for Red October Jack Ryan Universe 4,https://images.gr-assets.com/books/1281995542m/19691.jpg,https://www.goodreads.com/book/show/19691.The_Hunt_for_Red_October,432,274053,"Here is the runaway bestseller that launched Tom Clancy's phenomenal career. A military thriller so gripping in its action and so convincing in its accuracy that the author was rumored to have been debriefed by the White House. Its theme: the greatest espionage coup in history. Its story: the chase for a top secret Russian missile sub. Lauded by the Washington Post as ""breathlessly exciting."" The Hunt for Red October remains a masterpiece of military fiction by one of the world's most popular authors, a man whose shockingly realistic scenarios continue to hold us in thrall.Somewhere under the Atlantic, a Soviet sub commander has just made a fateful decision. The Red October is heading west. The Americans want her. The Russians want her back. And the most incredible chase in history is on...","['fiction', 'mystery, thriller, crime', 'history, historical fiction, biography']",Tom Clancy,466
59,15704307,Saga Vol 1 Saga 1,https://images.gr-assets.com/books/1486028947m/15704307.jpg,https://www.goodreads.com/book/show/15704307-saga-vol-1,160,142640,"When two soldiers from opposite sides of a never-ending galactic war fall in love, they risk everything to bring a fragile new life into a dangerous old universe.
From bestselling writer Brian K. Vaughan, Sagais the sweeping tale of one young family fighting to find their place in the worlds. Fantasy and science fiction are wed like never before in this sexy, subversive drama for adults.
Collecting: Saga1-6","['comics, graphic', 'fantasy, paranormal', 'fiction', 'romance']",Fiona Staples,154
60,17131869,Saga Vol 2 Saga 2,https://images.gr-assets.com/books/1486028954m/17131869.jpg,https://www.goodreads.com/book/show/17131869-saga-vol-2,144,58474,"From award-winning writer Brian K. Vaughan (Pride of Baghdad, Ex Machina) and critically acclaimed artist Fiona Staples (Mystery Society, Done to Death), Sagais sweeping tale of one young family fighting to find their place in the universe. Thanks to her star-crossed parents Marko and Alana, newborn baby Hazel has already survived lethal assassins, rampaging armies, and horrific monsters, but in the cold vastness of outer space, the little girl encounters her strangest adventure yet... grandparents.
Collecting: Saga7-12","['comics, graphic', 'fantasy, paranormal', 'fiction', 'romance']",Fiona Staples,537
61,19358975,Saga Vol 3 Saga 3,https://images.gr-assets.com/books/1486028973m/19358975.jpg,https://www.goodreads.com/book/show/19358975-saga-vol-3,144,50020,"From the Hugo Award-winning duo of Brian K. Vaughan (The Private Eye, Y: The Last Man) and Fiona Staples (North 40, Red Sonja), Saga is the sweeping tale of one young family fighting to find their place in the universe. Searching for their literary hero, new parents Marko and Alana travel to a cosmic lighthouse on the planet Quietus, while the couple's multiple pursuers finally close in on their targets.
Collecting: Saga13-18.","['comics, graphic', 'fantasy, paranormal', 'fiction', 'romance']",Fiona Staples,862
62,33917,The Namesake,https://images.gr-assets.com/books/1480106986m/33917.jpg,https://www.goodreads.com/book/show/33917.The_Namesake,291,186498,"Jhumpa Lahiri's Interpreter of Maladiesestablished this young writer as one the most brilliant of her generation. Her stories are one of the very few debut works -- and only a handful of collections -- to have won the Pulitzer Prize for fiction. Among the many other awards and honors it received were the New Yorker Debut of the Year award, the PEN/Hemingway Award, and the highest critical praise for its grace, acuity, and compassion in detailing lives transported from India to America.
In The Namesake, Lahiri enriches the themes that made her collection an international bestseller: the immigrant experience, the clash of cultures, the conflicts of assimilation, and, most poignantly, the tangled ties between generations. Here again Lahiri displays her deft touch for the perfect detail -- the fleeting moment, the turn of phrase -- that opens whole worlds of emotion.
The Namesaketakes the Ganguli family from their tradition-bound life in Calcutta through their fraught transformation into Americans. On the heels of their arranged wedding, Ashoke and Ashima Ganguli settle together in Cambridge, Massachusetts. An engineer by training, Ashoke adapts far less warily than his wife, who resists all things American and pines for her family. When their son is born, the task of naming him betrays the vexed results of bringing old ways to the new world. Named for a Russian writer by his Indian parents in memory of a catastrophe years before, Gogol Ganguli knows only that he suffers the burden of his heritage as well as his odd, antic name.
Lahiri brings great empathy to Gogol as he stumbles along the first-generation path, strewn with conflicting loyalties, comic detours, and wrenching love affairs. With penetrating insight, she reveals not only the defining power of the names and expectations bestowed upon us by our parents, but also the means by which we slowly, sometimes painfully, come to define ourselves.","['fiction', 'history, historical fiction, biography', 'romance']",Jhumpa Lahiri,638
63,20588698,Not That Kind of Girl A Young Woman Tells You What Shes Learned,https://images.gr-assets.com/books/1402816003m/20588698.jpg,https://www.goodreads.com/book/show/20588698-not-that-kind-of-girl,265,90345,"""There is nothing gutsier to me than a person announcing that their story is one that deserves to be told,"" writes Lena Dunham, and it certainly takes guts to share the stories that make up her first book, Not That Kind of Girl. These are stories about getting your butt touched by your boss, about friendship and dieting (kind of) and having two existential crises before the age of 20. Stories about travel, both successful and less so, and about having the kind of sex where you feel like keeping your sneakers on in case you have to run away during the act. Stories about proving yourself to a room of 50-year-old men in Hollywood and showing up to ""an outlandishly high-fashion event with the crustiest red nose you ever saw."" Fearless, smart, and as heartbreakingly honest as ever, Not That Kind of Girlestablishes Lena Dunham as more than a hugely talented director, actress and producer-it announces her as a fresh and vibrant new literary voice.","['non-fiction', 'history, historical fiction, biography', 'comics, graphic']",Joana Avillez,915
64,138398,The Walking Dead Vol 01 Days Gone Bye,https://images.gr-assets.com/books/1389233242m/138398.jpg,https://www.goodreads.com/book/show/138398.The_Walking_Dead_Vol_01,144,168436,"How many hours are in a day when you don't spend half of them watching television?When is the last time any of us REALLYworked to get something we wanted?
How long has it been since any of us really NEEDEDsomething that we WANTED?
The world we knew is gone.
The world of commerce and frivolous necessity has been replaced by a world of survival and responsibility.
An epidemic of apocalyptic proportions has swept the globe causing the dead to rise and feed on the living.
In a matter of months society has crumbled.
no government, no grocery stores, no mail delivery, no cable TV.
In a world ruled by the dead, we are forced to finally start living.","['comics, graphic', 'fiction', 'fantasy, paranormal', 'mystery, thriller, crime']",Tony Moore,899
