,book_id,title,image_url,url,num_pages,ratings_count,description,genre,name,book_id_mapping
21,41804,I Robot Robot 01,https://images.gr-assets.com/books/1388321463m/41804.jpg,https://www.goodreads.com/book/show/41804.I_Robot,224,201196,"The three laws of Robotics:
1) A robot may not injure a human being or, through inaction, allow a human being to come to harm.
2) A robot must obey orders given to it by human beings except where such orders would conflict with the First Law.
3) A robot must protect its own existence as long as such protection does not conflict with the First or Second Law.
With these three, simple directives, Isaac Asimov changed our perception of robots forever when he formulated the laws governing their behavior. In I, Robot, Asimov chronicles the development of the robot through a series of interlinked stories: from its primitive origins in the present to its ultimate perfection in the not-so-distant future--a future in which humanity itself may be rendered obsolete.
Here are stories of robots gone mad, of mind-read robots, and robots with a sense of humor. Of robot politicians, and robots who secretly run the world--all told with the dramatic blend of science fact and science fiction that has become Asimov's trademark.","['fiction', 'fantasy, paranormal', 'mystery, thriller, crime']",Isaac Asimov,835
22,186074,The Name of the Wind The Kingkiller Chronicle 1,https://images.gr-assets.com/books/1472068073m/186074.jpg,https://www.goodreads.com/book/show/186074.The_Name_of_the_Wind,662,416634,"Told in Kvothe's own voice, this is the tale of the magically gifted young man who grows to be the most notorious wizard his world has ever seen.
The intimate narrative of his childhood in a troupe of traveling players, his years spent as a near-feral orphan in a crime-ridden city, his daringly brazen yet successful bid to enter a legendary school of magic, and his life as a fugitive after the murder of a king form a gripping coming-of-age story unrivaled in recent literature.
A high-action story written with a poet's hand, The Name of the Windis a masterpiece that will transport readers into the body and mind of a wizard.","['fantasy, paranormal', 'fiction', 'young-adult', 'romance']",Patrick Rothfuss,199
23,9520360,The Son of Neptune The Heroes of Olympus 2,https://images.gr-assets.com/books/1464201114m/9520360.jpg,https://www.goodreads.com/book/show/9520360-the-son-of-neptune,521,307188,"Seven half-bloods shall answer the call,
To storm or fire the world must fall.
An oath to keep with a final breath,
And foes bear arms to the Doors of Death.
Percy is confused.When he awoke from his long sleep, he didn't know much more than his name. His brain fuzz is lingering, even after the wolf Lupa told him he is a demigod and trained him to fight with the pen/sword in his pocket. Somehow Percy manages to make it to a camp for half-bloods, despite the fact that he has to keep killing monsters along the way. But the camp doesn't ring any bells with him. The only thing he can recall from his past is another name: Annabeth.
Hazel is supposed to be dead.When she lived before, she didn't do a very good job of it. Sure, she was an obedient daughter, even when her mother was possessed by greed. But that was the problem -- when the Voice took over her mother and commanded Hazel to use her ""gift"" for an evil purpose, Hazel couldn't say no. Now because of her mistake, the future of the world is at risk. Hazel wished she could ride away from it all on the stallion that appears in her dreams.
Frank is a klutz.His grandmother says he is descended from heroes and can be anything he wants to be, but he doesn't see it. He doesn't even know who his father is. He keeps hoping Apollo will claim him, because the only thing he is good at is archery -- although not good enough to win camp war games. His bulky physique makes him feel like an ox, especially infront of Hazel, his closest friend at camp. He trusts her completely -- enough to share the secret he holds close to his heart.
Beginning at the ""other"" camp for half-bloods and extending as far as the land beyond the gods, this breathtaking second installment of the Heroes of Olympus series introduces new demigods, revives fearsome monsters, and features other remarkable creatures, all destined to play a part in the Prophesy of Seven.","['young-adult', 'fiction', 'children', 'fantasy, paranormal', 'romance']",Rick Riordan,626
24,6936382,Anna and the French Kiss Anna and the French Kiss 1,https://images.gr-assets.com/books/1358271931m/6936382.jpg,https://www.goodreads.com/book/show/6936382-anna-and-the-french-kiss,372,267364,"Anna is looking forward to her senior year in Atlanta, where she has a great job, a loyal best friend, and a crush on the verge of becoming more. Which is why she is less than thrilled about being shipped off to boarding school in Paris--until she meets Etienne St. Clair. Smart, charming, beautiful, Etienne has it all...including a serious girlfriend.
But in the City of Light, wishes have a way of coming true. Will a year of romantic near-misses end with their long-awaited French kiss?","['young-adult', 'romance', 'fiction']",Stephanie Perkins,207
25,7937462,The Short Second Life of Bree Tanner Twilight 35,https://images.gr-assets.com/books/1274335680m/7937462.jpg,https://www.goodreads.com/book/show/7937462-the-short-second-life-of-bree-tanner,178,147305,"Bree Tanner can barely remember life before she had uncannily powerful senses, superhuman reflexes, and unstoppable physical strength. Life before she had a relentless thirst for blood...life before she became a vampire.
All Bree knows is that living with her fellow newborns has few certainties and even fewer rules: watch your back, don't draw attention to yourself, and above all, make it home by sunrise or die. What she doesn't know: her time as an immortal is quickly running out.
Then Bree finds an unexpected friend in Diego, a newborn just as curious as Bree about their mysterious creator, whom they only know as her. As they come to realize that the newborns are pawns in a game larger than anything they could have imagined, Bree and Diego must choose sides and decide whom to trust. But when everything you know about vampires is based on a lie, how do you find the truth?","['young-adult', 'fantasy, paranormal', 'fiction', 'romance']",Stephenie Meyer,19
26,4502877,Midnight Sun Twilight 15,https://s.gr-assets.com/assets/nophoto/book/111x148-bcc042a9c91a29c1d680899eff700a03.png,https://www.goodreads.com/book/show/4502877-midnight-sun,264,138855,"Midnight Sunis the much anticipated retelling of Twilightfrom Edward Cullen's perspective. An unedited partial draft was illegally leaked onto the internet in 2008; consequently, author Stephenie Meyer put the project on indefinite hold.
Shortly afterward, she posted a letter to her fans on her website including a link to the entire partial draft of the book so that those who wanted to read it could do so legally and with her consent; see URL for more information.
Note:Do not add a cover. Do not add translations. Do not add any other editions.","['young-adult', 'fantasy, paranormal', 'romance', 'fiction']",Stephenie Meyer,760
27,16070903,Fallen Too Far Rosemary Beach 1 Too Far 1,https://images.gr-assets.com/books/1349565157m/16070903.jpg,https://www.goodreads.com/book/show/16070903-fallen-too-far,300,140420,"To want what you're not supposed to have...
She is only nineteen.
She is his new stepfather's daughter.
She is still naive and innocent due to spending the last three years taking care of her sick mother.
But for twenty-four year old Rush Finlay, she is the only thing that has ever been off limits. His famous father's guilt money, his mother's desperation to win his love, and his charm are the three reasons he has never been told no.
Blaire Wynn left her small farmhouse in Alabama, after her mother passed away, to move in with her father and his new wife in their sprawling beach house along the Florida gulf coast. She isn't prepared for the lifestyle change and she knows she'll never fit into this world. Then there is her sexy stepbrother who her father leaves her with for the summer while he runs off to Paris with his wife. Rush is as spoiled as he is gorgeous. He is also getting under her skin. She knows he is anything but good for her and that he'll never be faithful to anyone. He is jaded and has secrets Blaire knows she may never uncover but even knowing all of that...
Blaire just may have fallen too far.","['romance', 'young-adult', 'fiction']",Abbi Glines,282
28,391729,The TellTale Heart and Other Writings,https://images.gr-assets.com/books/1327936583m/391729.jpg,https://www.goodreads.com/book/show/391729.The_Tell_Tale_Heart_and_Other_Writings,448,196577,"Edgar Allan Poe remains the unsurpassed master of works of mystery and madness in this outstanding collection of Poe's prose and poetry are sixteen of his finest tales, including ""The Tell-Tale Heart"", ""The Murders in the Rue Morgue"", ""The Fall of the House of Usher,"" ""The Pit and the Pendulum,"" ""William Wilson,"" ""The Black Cat,"" ""The Cask of Amontillado,"" and ""Eleonora"". Here too is a major selection of what Poe characterized as the passion of his life, his poems - ""The Raven,"" ""Annabel Lee,"" Ulalume,"" ""Lenore,"" ""The Bells,"" and more, plus his glorious prose poem ""Silence - A Fable"" and only full-length novel, The Narrative of Arthur Gordon Pym.","['fiction', 'fantasy, paranormal', 'mystery, thriller, crime', 'poetry', 'young-adult', 'history, historical fiction, biography']",Edgar Allan Poe,616
29,13642,A Wizard of Earthsea Earthsea Cycle 1,https://images.gr-assets.com/books/1353424536m/13642.jpg,https://www.goodreads.com/book/show/13642.A_Wizard_of_Earthsea,183,157732,"Ged, the greatest sorcerer in all Earthsea, was called Sparrowhawk in his reckless youth.
Hungry for power and knowledge, Sparrowhawk tampered with long-held secrets and loosed a terrible shadow upon the world. This is the tale of his testing, how he mastered the mighty words of power, tamed an ancient dragon, and crossed death's threshold to restore the balance.","['fiction', 'young-adult', 'fantasy, paranormal', 'children']",Ursula K. Le Guin,706
30,5139,The Devil Wears Prada The Devil Wears Prada 1,https://s.gr-assets.com/assets/nophoto/book/111x148-bcc042a9c91a29c1d680899eff700a03.png,https://www.goodreads.com/book/show/5139.The_Devil_Wears_Prada,432,675927,"A delightfully dishy novel about the all-time most impossible boss in the history of impossible bosses.
Andrea Sachs, a small-town girl fresh out of college, lands the job ""a million girls would die for."" Hired as the assistant to Miranda Priestly, the high-profile, fabulously successful editor of ""Runway ""magazine, Andrea finds herself in an office that shouts ""Prada! Armani! Versace!"" at every turn, a world populated by impossibly thin, heart-wrenchingly stylish women and beautiful men clad in fine-ribbed turtlenecks and tight leather pants that show off their lifelong dedication to the gym. With breathtaking ease, Miranda can turn each and every one of these hip sophisticates into a scared, whimpering child.
THE DEVIL WEARS PRADA gives a rich and hilarious new meaning to complaints about ""The Boss from Hell."" Narrated in Andrea's smart, refreshingly disarming voice, it traces a deep, dark, devilish view of life at the top only hinted at in gossip columns and over Cosmopolitans at the trendiest cocktail parties. From sending the latest, not-yet-in-stores Harry Potter to Miranda's children in Paris by private jet, to locating an unnamed antique store where Miranda had at some point admired a vintage dresser, to serving lattes to Miranda at precisely the piping hot temperature she prefers, Andrea is sorely tested each and every day--and often late into the night with orders barked over the phone. She puts up with it all by keeping her eyes on the prize: a recommendation from Miranda that will get Andrea a top job at any magazine of her choosing. As things escalate from the merely unacceptable to the downright outrageous, however, Andrea begins to realize that the job a million girls would die for may just kill her. And even if she survives, she has to decide whether or not the job is worth the price of her soul.","['fiction', 'romance', 'young-adult']",Lauren Weisberger,228
31,1202,Freakonomics A Rogue Economist Explores the Hidden Side of Everything Freakonomics 1,https://images.gr-assets.com/books/1327909092m/1202.jpg,https://www.goodreads.com/book/show/1202.Freakonomics,320,529274,"Which is more dangerous, a gun or a swimming pool? What do schoolteachers and sumo wrestlers have in common? Why do drug dealers still live with their moms? How much do parents really matter? What kind of impact did Roe v. Wade have on violent crime? Freakonomics will literally redefine the way we view the modern world.
These may not sound like typical questions for an economist to ask. But Steven D. Levitt is not a typical economist. He is a much heralded scholar who studies the stuff and riddles of everyday life -- from cheating and crime to sports and child rearing -- and whose conclusions regularly turn the conventional wisdom on its head. He usually begins with a mountain of data and a simple, unasked question. Some of these questions concern life-and-death issues; others have an admittedly freakish quality. Thus the new field of study contained in this book: freakonomics.
Through forceful storytelling and wry insight, Levitt and co-author Stephen J. Dubner show that economics is, at root, the study of incentives -- how people get what they want, or need, especially when other people want or need the same thing. In Freakonomics, they set out to explore the hidden side of ... well, everything. The inner workings of a crack gang. The truth about real-estate agents. The myths of campaign finance. The telltale marks of a cheating schoolteacher. The secrets of the Ku Klux Klan.
What unites all these stories is a belief that the modern world, despite a surfeit of obfuscation, complication, and downright deceit, is not impenetrable, is not unknowable, and -- if the right questions are asked -- is even more intriguing than we think. All it takes is a new way of looking. Steven Levitt, through devilishly clever and clear-eyed thinking, shows how to see through all the clutter.
Freakonomics establishes this unconventional premise: If morality represents how we would like the world to work, then economics represents how it actually does work. It is true that readers of this book will be armed with enough riddles and stories to last a thousand cocktail parties. But Freakonomics can provide more than that. It will literally redefine the way we view the modern world.","['non-fiction', 'history, historical fiction, biography', 'fiction']",Stephen J. Dubner,306
32,11500217,Angelfall Penryn the End of Days 1,https://images.gr-assets.com/books/1423238576m/11500217.jpg,https://www.goodreads.com/book/show/11500217-angelfall,326,74116,"It's been six weeks since angels of the apocalypse descended to demolish the modern world. Street gangs rule the day while fear and superstition rule the night. When warrior angels fly away with a helpless little girl, her seventeen-year-old sister Penryn will do anything to get her back.
Anything, including making a deal with an enemy angel.
Raffe is a warrior who lies broken and wingless on the street. After eons of fighting his own battles, he finds himself being rescued from a desperate situation by a half-starved teenage girl.
Traveling through a dark and twisted Northern California, they have only each other to rely on for survival. Together, they journey toward the angels' stronghold in San Francisco where she'll risk everything to rescue her sister and he'll put himself at the mercy of his greatest enemies for the chance to be made whole again.","['fantasy, paranormal', 'young-adult', 'romance', 'fiction']",Susan Ee,759
33,227443,Bridget Joness Diary Bridget Jones 1,https://images.gr-assets.com/books/1292060045m/227443.jpg,https://www.goodreads.com/book/show/227443.Bridget_Jones_s_Diary,288,748926,"Meet Bridget Jones--a 30-something Singleton who is certain she would have all the answers if she could:
a. lose 7 pounds
b. stop smoking
c. develop Inner Poise
""123 lbs. (how is it possible to put on 4 pounds in the middle of the night? Could flesh have somehow solidified becoming denser and heavier? Repulsive, horrifying notion), alcohol units 4 (excellent), cigarettes 21 (poor but will give up totally tomorrow), number of correct lottery numbers 2 (better, but nevertheless useless)...""
Bridget Jones' Diaryis the devastatingly self-aware, laugh-out-loud daily chronicle of Bridget's permanent, doomed quest for self-improvement -- a year in which she resolves to: reduce the circumference of each thigh by 1.5 inches, visit the gym three times a week not just to buy a sandwich, form a functional relationship with a responsible adult, and learn to program the VCR.
Over the course of the year, Bridget loses a total of 72 pounds but gains a total of 74. She remains, however, optimistic. Through it all, Bridget will have you helpless with laughter, and -- like millions of readers the world round -- you'll find yourself shouting, ""Bridget Jones is me!""","['fiction', 'romance']",Helen Fielding,240
34,76620,Watership Down Watership Down 1,https://images.gr-assets.com/books/1405136931m/76620.jpg,https://www.goodreads.com/book/show/76620.Watership_Down,478,297140,"Set in England's Downs, a once idyllic rural landscape, this stirring tale of adventure, courage and survival follows a band of very special creatures on their flight from the intrusion of man and the certain destruction of their home. Led by a stouthearted pair of friends, they journey forth from their native Sandleford Warren through the harrowing trials posed by predators and adversaries, to a mysterious promised land and a more perfect society.","['fiction', 'fantasy, paranormal', 'young-adult', 'children']",Richard Adams,576
35,5358,The Firm Penguin Readers Level 5,https://images.gr-assets.com/books/1418465200m/5358.jpg,https://www.goodreads.com/book/show/5358.The_Firm,75,494812,"Mitch McDeere is young, intelligent and ambitious. When he gets a job with the law firm of Bendini, Lambert, & Locke it seems to be the path to money and power. But soon Mitch finds that the firm is listening to all his phone calls, and the FBI wants to speak to him. Money and power has a price, and it could be Mitch's life.","['mystery, thriller, crime', 'fiction']",John Grisham,279
36,12067,Good Omens The Nice and Accurate Prophecies of Agnes Nutter Witch,https://images.gr-assets.com/books/1392528568m/12067.jpg,https://www.goodreads.com/book/show/12067.Good_Omens,412,307430,"An alternative cover for this ISBN can be found 
According to The Nice and Accurate Prophecies of Agnes Nutter, Witch(the world's only completelyaccurate book of prophecies, written in 1655, before she exploded), the world will end on a Saturday. Next Saturday, in fact. Just before dinner.
So the armies of Good and Evil are amassing, Atlantis is rising, frogs are falling, tempers are flaring. Everything appears to be going according to Divine Plan. Except a somewhat fussy angel and a fast-living demon--both of whom have lived amongst Earth's mortals since The Beginning and have grown rather fond of the lifestyle--are not actually looking forward to the coming Rapture.
And someone seems to have misplaced the Antichrist . . .","['fantasy, paranormal', 'fiction', 'young-adult']",Neil Gaiman,396
37,30119,Where the Sidewalk Ends,https://images.gr-assets.com/books/1168052448m/30119.jpg,https://www.goodreads.com/book/show/30119.Where_the_Sidewalk_Ends,176,1029527,"Where the Sidewalk Ends turns forty! Celebrate with this anniversary edition that features an eye-catching commemorative red sticker. This classic poetry collection, which is both outrageously funny and profound, has been the most beloved of Shel Silverstein's poetry books for generations.
Where the sidewalk ends, Shel Silverstein's world begins. There you'll meet a boy who turns into a TV set and a girl who eats a whale. The Unicorn and the Bloath live there, and so does Sarah Cynthia Sylvia Stout who will not take the garbage out. It is a place where you wash your shadow and plant diamond gardens, a place where shoes fly, sisters are auctioned off, and crocodiles go to the dentist.
Shel Silverstein's masterful collection of poems and drawings is one of Parent & Child magazine's 100 Greatest Books for Kids. School Library Journal said, ""Silverstein has an excellent sense of rhythm and rhyme and a good ear for alliteration and assonance that make these poems a pleasure to read aloud.""
Shel Silverstein's incomparable career as a children's book author and illustrator began with Lafcadio, the Lion Who Shot Back. In 1964, Shel's creativity continued to flourish as four more books were published in the same year--Don't Bump the Glump!, A Giraffe and a Half, Who Wants a Cheap Rhinoceros?, and the beloved classic The Giving Tree. Later he continued to build his remarkable body of work with Where the Sidewalk Ends, A Light in the Attic, Falling Up, Every Thing On It, The Missing Piece, The Missing Piece Meets the Big O, and Runny Babbit.","['poetry', 'children', 'fiction', 'young-adult', 'fantasy, paranormal', 'non-fiction']",Shel Silverstein,211
38,4948,The Very Hungry Caterpillar,https://images.gr-assets.com/books/1510184094m/4948.jpg,https://www.goodreads.com/book/show/4948.The_Very_Hungry_Caterpillar,26,304842,Eric Carle's The Very Hungry Caterpillaris a perennial favorite with children and adults alike. Its imaginative illustration and clever cut-out detail charts the progress of a very hungry caterpillar as he eats his way through the week.,"['children', 'fiction', 'fantasy, paranormal', 'young-adult']",Eric Carle,798
39,22738563,We Should All Be Feminists,https://images.gr-assets.com/books/1430821222m/22738563.jpg,https://www.goodreads.com/book/show/22738563-we-should-all-be-feminists,52,51354,"What does ""feminism"" mean today? That is the question at the heart of We Should All Be Feminists, a personal, eloquently-argued essay--adapted from her much-viewed TEDx talk of the same name--by Chimamanda Ngozi Adichie, the award-winning author of Americanahand Half of a Yellow Sun.
With humor and levity, here Adichie offers readers a unique definition of feminism for the twenty-first century--one rooted in inclusion and awareness. She shines a light not only on blatant discrimination, but also the more insidious, institutional behaviors that marginalize women around the world, in order to help readers of all walks of life better understand the often masked realities of sexual politics. Throughout, she draws extensively on her own experiences--in the U.S., in her native Nigeria, and abroad--offering an artfully nuanced explanation of why the gender divide is harmful for women and men, alike.
Argued in the same observant, witty and clever prose that has made Adichie a bestselling novelist, here is one remarkable author's exploration of what it means to be a woman today--and an of-the-moment rallying cry for why we should all be feminists.",['non-fiction'],Chimamanda Ngozi Adichie,585
40,3431,The Five People You Meet in Heaven,https://s.gr-assets.com/assets/nophoto/book/111x148-bcc042a9c91a29c1d680899eff700a03.png,https://www.goodreads.com/book/show/3431.The_Five_People_You_Meet_in_Heaven,196,453494,"From the author of Tuesdays with Morrie, a novel that explores the unexpected connections of our lives, and the idea that heaven is more than a place; it's an answer.
From the author of the phenomenal #1 New York Times bestseller Tuesdays with Morrie, a novel that explores the unexpected connections of our lives, and the idea that heaven is more than a place; it's an answer.
Eddie is a wounded war veteran, an old man who has lived, in his mind, an uninspired life. His job is fixing rides at a seaside amusement park. On his 83rd birthday, a tragic accident kills him as he tries to save a little girl from a falling cart. He awakes in the afterlife, where he learns that heaven is not a destination. It's a place where your life is explained to you by five people, some of whom you knew, others who may have been strangers. One by one, from childhood to soldier to old age, Eddie's five people revisit their connections to him on earth, illuminating the mysteries of his ""meaningless"" life, and revealing the haunting secret behind the eternal question: ""Why was I here?""","['fiction', 'non-fiction', 'young-adult', 'romance']",Mitch Albom,523
41,386372,Mort Death 1 Discworld 4,https://s.gr-assets.com/assets/nophoto/book/111x148-bcc042a9c91a29c1d680899eff700a03.png,https://www.goodreads.com/book/show/386372.Mort,243,131684,"Terry Pratchett's profoundly irreverent novels are consistent number one bestseller in England, where they have catapulted him into the highest echelons of parody next to Mark Twain, Kurt Vonnegut, Douglas Adams, and Carl Hiaasen.
In this Discworld installment, Death comes to Mort with an offer he can't refuse -- especially since being, well, dead isn't compulsory. As Death's apprentice, he'll have free board and lodging, use of the company horse, and he won't need time off for family funerals. The position is everything Mort thought he'd ever wanted, until he discovers that this perfect job can be a killer on his love life.","['fantasy, paranormal', 'fiction', 'comics, graphic', 'young-adult']",Terry Pratchett,735
